Index,Question,1: Strongly Disagree,2: Disagree,3: Neutral,4: Agree,5: Strongly Agree
0,"I require a car to commute daily needs. (ex. Work, Grocery, etc.)",27,18,19,16,20
1,My transportation options have prevented me from accessing medical care.,21,16,20,15,28
2,I am satisfied with my ability to walk in my community.,25,14,15,21,25
3,I am satisfied with my proximity to a Metro station.,20,17,16,23,24
4,I feel connected to my community. ,18,18,20,20,24
5,I feel safe when using or living near a Metro station.,19,20,27,20,14
